{
  "id": "FID-0098",
  "title": "draw_watch_inventory_page: guPerspective aspect passes 1.2857143 in port vs retail 1.3333334 (4/3) for the watch inventory 3D item",
  "class": "parity-divergence",
  "surface": "renderer",
  "priority": "P3",
  "status": "discovered",
  "suspect": [],
  "repro": "Open the watch (pause) inventory page and view the 3D weapon/item model. The port builds its perspective projection with aspect 1.2857143 (9/7) instead of the retail 1.3333334 (4/3), so the rendered item is slightly narrower/taller than on N64. Pixel-parity vs an ares capture is unverified.",
  "evidence": [
    {
      "kind": "asm-citation",
      "path": "src/game/watch.c:4147"
    }
  ],
  "history": [
    {
      "ts": "2026-07-11T21:00:20Z",
      "from": "",
      "to": "discovered",
      "evidence": "src/game/watch.c:4147",
      "note": "Retail draw_watch_inventory_page (glabel watch.c:4027, VERSION_US) calls guPerspective(mtx, perspNorm, different45angle, aspect, near, far, scale) with aspect in a3 = immediate 0x3FAAAAAB (watch.c:4147-4148 lui/ori) = 1.3333334 = 4/3, near = 10.0 (li 0x41200000), far = D_80058528 = 0x461C4000 = 10000.0 (watch.c:3187), scale = 1.0. Live NATIVE_PORT C (watch.c:3926) passes guPerspective(mtx, perspNorm, different45angle, 1.2857143f, 10.0f, 10000.0f, 1.0f). fovy (different45angle from bondinvGet45AngleForIndex), near, far and scale all match; only the aspect differs: 1.2857143f compiles to 0x3FA49249, which does NOT round-trip to the retail 0x3FAAAAAB, so the port produces a different projection matrix for the HUD-space item. This is analogous to the sibling watch-scene aspect divergence in FID-0068 (retail 0x3FBA2E8C = 1.4545455 vs C 1.456f). Because a HUD-space item aspect has no widescreen-correction rationale and the constant does not round-trip, this most likely is an accidental transcription error (leaning port-defect); classified parity-divergence pending an ares pixel-parity capture confirming the on-screen proportion change, and it lacks an A/B negative-control flag. EVERYTHING ELSE in draw_watch_inventory_page verified equivalent to the US ASM: draw_background_health_and_armor, check_watch_page_transistion_running==1 early return, dynAllocateMatrix, the seven bondinv per-index getters (45angle/Hoffset/Voffset/Depth/text/Xrot/Yrot), the get_debug_gunwatchpos_flag debug block (gitem_structs stride 0x38, six joyGetButtons 2/1/4/8/32/16 adjusting watch_pos_y at 0x2c, watch_pos_x at 0x30, watch_pos_z at 0x34 by plus/minus 2.0 and multiply by D_80058520=0.98 / D_80058524=1.0204082), gSPMatrix projection load, both matrix_4x4 rotation builds (yrot and 6.2831855 minus xrot scaled by D_8005852C/D_80058530 over 360.0), matrix_4x4_7F059694 with cos/sin(D_80040B14)*depth, sub_GAME_7F0A6EE8, set_enviro_fog_for_items_in_solo_watch_menu(gdl, weapontext, mtxf, 64, 0xA0FFA03C), the inventory-text strcat loop over bondinvCountTotalItemsInInv, D_800409C4 decrement (blez guard), the j_text_trigger 14-vs-12 line metric ternaries at every use, xpos=0x4E ypos=0x8C yoffset=(14or12)*2+0x8D constants, textMeasure, both microcode_constructor_related_to_menus calls (0x4E/0x8C/textwidth+0x4E and 0x4B/yoffset/textwidth+0x52 with color 0x800050), textRender color 0x00AA00B0, the sprintf(aDDDF) with D_800409BC promoted to f64, the D_800409C0 gate, and the D_800409C4==0 textRender(color 0xA0FFA0F0) vs textRenderGlow(-1, color 0x007000A0) split + sub_GAME_7F0A8378. Found by ASM-audit batch 10, queue rank 108, region US."
    }
  ]
}
